{
  "schema": "artifact/requirement",
  "version": 1,
  "id": "USR-001",
  "kind": "original",
  "summary": "Define portable contract schemas for Agent Rules v2",
  "body": "Introduce versioned schemas that describe portable artifacts independently of any specific agent platform.",
  "captured_at": "2026-07-25T07:00:00Z",
  "source_ref": "user-request",
  "redacted": false,
  "slice_ids": ["S1", "S2"]
}
